{
  "$schema": "https://json-schema.org/draft/2020-12/schema",
  "title": "SmartVehicle Platform Configuration",
  "type": "object",
  "required": [
    "schema_version", "profile", "platform", "runnable", "transport",
    "signal_provider", "adapters", "enabled_services", "service_dependencies",
    "api_versions", "resource_limits", "security", "ota", "logging"
  ],
  "properties": {
    "schema_version": {"const": "1.0"},
    "profile": {"type": "string", "minLength": 1},
    "platform": {"type": "string", "minLength": 1},
    "runnable": {"type": "boolean"},
    "transport": {"enum": ["in_process"]},
    "signal_provider": {"type": "string", "minLength": 1},
    "adapters": {
      "type": "object",
      "required": ["crypto", "can", "ota_slots"],
      "properties": {
        "crypto": {"type": "string", "minLength": 1},
        "can": {"type": "string", "minLength": 1},
        "ota_slots": {"type": "string", "minLength": 1}
      },
      "additionalProperties": false
    },
    "enabled_services": {
      "type": "array", "minItems": 1, "uniqueItems": true,
      "items": {"type": "string"}
    },
    "service_dependencies": {"type": "object"},
    "api_versions": {"type": "object"},
    "resource_limits": {"type": "object"},
    "security": {"type": "object"},
    "ota": {"type": "object"},
    "logging": {"type": "object"}
  },
  "additionalProperties": false
}
